;opis;dzielnica;pokoje;cena;metraz;cena_za_metr;link;data;pietro;l_pieter;rok_bud;ulica;lokator_ulica_dzielnica;geo_location;point;latitude;longitude;altitude;geometry
102 m²;Mieszkanie cały segment Kraków Zielonki z ogrodem;Kraków , małopolskie;5 pokoi;520000.0;102.0;5098.0;https://www.otodom.pl/oferta/mieszkanie-caly-segment-krakow-zielonki-z-ogrodem-ID3UosE.html#de3f47c1fe;2020-02-23 10:09:31.610895;0.0;2.0;2019.0;Zielonki;Kraków , małopolskie, Zielonki;Kraków Batowice, Szmaragdowa, Dziekanowice, gmina Zielonki, powiat krakowski, województwo małopolskie, 31-670, Polska;(50.1075321, 19.9954682, 0.0);50.1075321;19.9954682;0.0;POINT (571161.0472199975 249395.2047672737)
46 m²;Mieszkanie 46m Adama Bochenka od WŁAŚCICIELA;Kraków , Podgórze Duchackie, Piaski Wielkie;3 pokoje;446000.0;46.0;9696.0;https://www.otodom.pl/oferta/mieszkanie-46m-adama-bochenka-od-wlasciciela-ID44FtY.html#de3f47c1fe;2020-02-23 10:09:37.179573;10.0;11.0;2019.0;Bochenka;Kraków , Podgórze Duchackie, Piaski Wielkie, Bochenka;Bochenka N/Ż, Łużycka, Podgórze Duchackie, Kraków, województwo małopolskie, 30-658, Polska;(50.0102723, 19.9711669, 0.0);50.0102723;19.9711669;0.0;POINT (569564.4003208186 238561.9453801522)
71,46 m²;Ruczaj. Grota-Roweckiego. 72m, 4/4. (Z potencjałem;Kraków , Dębniki, Ruczaj;4 pokoje;569000.0;71.46;7962.0;https://www.otodom.pl/oferta/ruczaj-grota-roweckiego-72m-4-4-z-potencjalem-ID44kpG.html#de3f47c1fe;2020-02-23 10:09:40.027506;4.0;4.0;1989.0;Grota-Roweckiego;Kraków , Dębniki, Ruczaj, Grota-Roweckiego;Generała Stefana Grota-Roweckiego, Osiedle Ruczaj-Zaborze, Łagiewniki-Borek Fałęcki, Delegatura Kraków-Podgórze, Kraków, województwo małopolskie, 30-376, Polska;(50.0293477, 19.91197, 0.0);50.0293477;19.91197;0.0;POINT (565298.3461236949 240628.7681384189)
30 m²;Mieszkanie do wprowadzenia - Rondo Matecznego;Kraków , Podgórze;1 pokój;369900.0;30.0;12330.0;https://www.otodom.pl/oferta/mieszkanie-do-wprowadzenia-rondo-matecznego-ID440Oz.html#de3f47c1fe;2020-02-23 10:09:47.594688;3.0;5.0;1997.0;Matecznego;Kraków , Podgórze, Matecznego;Rondo Antoniego Matecznego, Mateczny, Podgórze, Delegatura Kraków-Podgórze, Kraków, województwo małopolskie, 30-524, Polska;(50.0367797, 19.9405272, 0.0);50.0367797;19.9405272;0.0;POINT (567332.6572123085 241480.1638806006)
53 m²;2 pok. /53m2/Podgórze/Kurdwanów/ul. Bujaka;Kraków , Podgórze Duchackie, Kurdwanów;2 pokoje;399000.0;53.0;7528.0;https://www.otodom.pl/oferta/2-pok-53m2-podgorze-kurdwanow-ul-bujaka-ID4489u.html#de3f47c1fe;2020-02-23 10:09:57.939165;3.0;4.0;2005.0;Bujaka;Kraków , Podgórze Duchackie, Kurdwanów, Bujaka;Bujaka, Kurdwanów, Podgórze Duchackie, Delegatura Kraków-Podgórze, Kraków, województwo małopolskie, Polska;(50.009635200000005, 19.948395750000003, 0.0);50.009635200000005;19.948395750000003;0.0;POINT (567934.2337184104 238470.1971203024)
21 m²;Kawalerka okolica placu Bieńczyckiego;Kraków , Nowa Huta;1 pokój;199000.0;21.0;9476.0;https://www.otodom.pl/oferta/kawalerka-okolica-placu-bienczyckiego-ID44OJ4.html#de3f47c1fe;2020-02-23 10:09:58.978575;1.0;3.0;1965.0;Bieńczyckie;Kraków , Nowa Huta, Bieńczyckie;Planty Bieńczyckie, Bieńczyce, Kraków, województwo małopolskie, 31-944, Polska;(50.080262, 20.0278412, 0.0);50.080262;20.0278412;0.0;POINT (573516.903503144 246395.4899430936)
57,60 m²;ZIELONKI !! Popielate Wzgórza 2.0!! II ETAP !!;Kraków , Prądnik Biały;3 pokoje;409000.0;57.6;7101.0;https://www.otodom.pl/oferta/zielonki-popielate-wzgorza-2-0-ii-etap-ID40Mtj.html#de3f47c1fe;2020-02-23 10:10:00.029821;0.0;2.0;2019.0;Popiela;Kraków , Prądnik Biały, Popiela;Kronikarza Galla, Łobzów, Krowodrza, Kraków, województwo małopolskie, 30-053, Polska;(50.0744391, 19.9149159, 0.0);50.0744391;19.9149159;0.0;POINT (565447.914190442 245643.2424971201)
45 m²;Sprzedam 45 m2 Czyżyny 2 Pułku Lotniczego;Kraków , Nowa Huta, Czyżyny;1 pokój;429000.0;45.0;9533.0;https://www.otodom.pl/oferta/sprzedam-45-m2-czyzyny-2-pulku-lotniczego-ID44AOW.html#bcc2421ba9;2020-02-23 10:10:11.622077;1.0;7.0;2000.0;Lotniczego;Kraków , Nowa Huta, Czyżyny, Lotniczego;Osiedle 2. Pułku Lotniczego, Czyżyny, Kraków, województwo małopolskie, Polska;(50.077365900000004, 20.008722110064895, 0.0);50.077365900000004;20.008722110064895;0.0;POINT (572153.7719664697 246054.9480282031)
63 m²;2 pokoje, osobna kuchnia, 63 m2, Kraków Rydlówka;Kraków , Podgórze;2 pokoje;598437.0;63.0;9499.0;https://www.otodom.pl/oferta/2-pokoje-osobna-kuchnia-63-m2-krakow-rydlowka-ID44Bhy.html#bcc2421ba9;2020-02-23 10:10:12.395310;0.0;6.0;2008.0;Rydlówka;Kraków , Podgórze, Rydlówka;Rydlówka, Mateczny, Podgórze, Delegatura Kraków-Podgórze, Kraków, województwo małopolskie, 30-415, Polska;(50.0352782, 19.9349524, 0.0);50.0352782;19.9349524;0.0;POINT (566935.6490624668 241308.2663329504)
64,68 m²;Umeblowane, gotowe,3-pok.mieszkanie na Zabłociu;Kraków , Podgórze, Zabłocie;3 pokoje;779000.0;64.68;12044.0;https://www.otodom.pl/oferta/umeblowane-gotowe-3-pok-mieszkanie-na-zablociu-ID44OCd.html#bcc2421ba9;2020-02-23 10:10:17.861088;1.0;7.0;2005.0;Zabłocie;Kraków , Podgórze, Zabłocie, Zabłocie;Zabłocie, Podgórze, Delegatura Kraków-Podgórze, Kraków, województwo małopolskie, 30-701, Polska;(50.0504146, 19.9594445, 0.0);50.0504146;19.9594445;0.0;POINT (568667.4764171189 243012.885782999)
52 m²;Sprzedam mieszkanie 52m2, Dębniki ul. Bałuckiego 5;Kraków , Dębniki;2 pokoje;639000.0;52.0;12288.0;https://www.otodom.pl/oferta/sprzedam-mieszkanie-52m2-debniki-ul-baluckiego-5-ID44GqJ.html#e7b1ebfb0e;2020-02-23 10:10:38.019847;1.0;4.0;1970.0;Bałuckiego;Kraków , Dębniki, Bałuckiego;Konfederacka, Michała Bałuckiego, Dębniki, Delegatura Kraków-Podgórze, Kraków, województwo małopolskie, 30-104, Polska;(50.0496526, 19.9258888, 0.0);50.0496526;19.9258888;0.0;POINT (566266.9802198876 242897.8969186656)
58,88 m²;3-pokojowe mieszkanie przy pl. Bohaterów Getta;Kraków , Podgórze;3 pokoje;662704.0;58.88;11255.0;https://www.otodom.pl/oferta/3-pokojowe-mieszkanie-przy-pl-bohaterow-getta-ID42H3N.html#e7b1ebfb0e;2020-02-23 10:10:44.698971;3.0;4.0;2019.0;Getta;Kraków , Podgórze, Getta;Plac Bohaterów Getta, Ludwinów, Podgórze, Delegatura Kraków-Podgórze, Kraków, województwo małopolskie, Polska;(50.0467232, 19.95438111538139, 0.0);50.0467232;19.95438111538139;0.0;POINT (568310.3352903129 242597.9485702962)
57,36 m²;ul. Czarnogórska 18, 57 m2 dwa balkony + garaż;Kraków , Podgórze Duchackie, Wola Duchacka;3 pokoje;545000.0;57.36;9501.0;https://www.otodom.pl/oferta/ul-czarnogorska-18-57-m2-dwa-balkony-garaz-ID40HtC.html#e7b1ebfb0e;2020-02-23 10:10:49.742065;1.0;3.0;2009.0;Czarnogórska;Kraków , Podgórze Duchackie, Wola Duchacka, Czarnogórska;Czarnogórska, Wola Duchacka Wschód, Podgórze Duchackie, Kraków, województwo małopolskie, 30-630, Polska;(50.0197183, 19.9709187, 0.0);50.0197183;19.9709187;0.0;POINT (569532.9887365557 239611.625416046)
46,51 m²;Przytulne do wprowadzenia 51m Chełmońskiego;Kraków , Prądnik Biały;2 pokoje;439000.0;46.51;9439.0;https://www.otodom.pl/oferta/przytulne-do-wprowadzenia-51m-chelmonskiego-ID44dnl.html#e7b1ebfb0e;2020-02-23 10:10:57.541008;2.0;2.0;2008.0;Chełmońskiego;Kraków , Prądnik Biały, Chełmońskiego;Józefa Chełmońskiego, Bronowice Wielkie, Bronowice, Delegatura Kraków-Krowodrza, Kraków, województwo małopolskie, 31-346, Polska;(50.0983351, 19.890461, 0.0);50.0983351;19.890461;0.0;POINT (563666.9097622773 248278.1576568913)
56,50 m²;Mieszkanie 3 pokoje wysoki standard Prądnik Biały;Kraków , Prądnik Biały;3 pokoje;600000.0;56.5;10619.0;https://www.otodom.pl/oferta/mieszkanie-3-pokoje-wysoki-standard-pradnik-bialy-ID44Otr.html#51e2ab8c8f;2020-02-23 10:11:14.269879;7.0;8.0;2014.0;Prądnicka;Kraków , Prądnik Biały, Prądnicka;Prądnicka, Prądnik Biały, Kraków, województwo małopolskie, 31-202, Polska;(50.0875229, 19.9385333, 0.0);50.0875229;19.9385333;0.0;POINT (567119.0717439586 247118.4659837764)
26,56 m²;1 Pok. | Rakowicka | Novum II | Stare Miasto |Eng.;Kraków , Stare Miasto;1 pokój;355500.0;26.56;13385.0;https://www.otodom.pl/oferta/1-pok-rakowicka-novum-ii-stare-miasto-eng-ID44Otd.html#51e2ab8c8f;2020-02-23 10:11:18.942389;0.0;6.0;2019.0;Rakowicka;Kraków , Stare Miasto, Rakowicka;Rakowicka, Warszawskie, Grzegórzki, Delegatura Kraków-Śródmieście, Kraków, województwo małopolskie, 31-520, Polska;(50.0751438, 19.9577519, 0.0);50.0751438;19.9577519;0.0;POINT (568511.1065507758 245759.9750759406)
32,22 m²;Słoneczna kawalerka w sąsiedztwie Ronda Matecznego;Kraków , Podgórze;1 pokój;330000.0;32.22;10242.0;https://www.otodom.pl/oferta/sloneczna-kawalerka-w-sasiedztwie-ronda-matecznego-ID44GNl.html#51e2ab8c8f;2020-02-23 10:11:21.305803;3.0;4.0;1975.0;Słoneczne;Kraków , Podgórze, Słoneczne;Słoneczne Miasteczko, Bieżanów-Prokocim, Kraków, województwo małopolskie, Polska;(50.01992195, 20.056424288413524, 0.0);50.01992195;20.056424288413524;0.0;POINT (575656.0931287106 239717.2828907873)
70 m²;Kraków, Kazimierza Wlk 70m2 od właściciela!;Kraków , Krowodrza;4 pokoje;655000.0;70.0;9357.0;https://www.otodom.pl/oferta/krakow-kazimierza-wlk-70m2-od-wlasciciela-ID43Pvu.html#51e2ab8c8f;2020-02-23 10:11:25.742879;4.0;5.0;1994.0;Kazimierza;Kraków , Krowodrza, Kazimierza;Kinesis Rehabilitacja Kraków, 57, Kazimierza Wielkiego, Nowa Wieś, Krowodrza, Kraków, województwo małopolskie, 30-074, Polska;(50.073573, 19.9193678, 0.0);50.073573;19.9193678;0.0;POINT (565767.5578813277 245550.8849675544)
62 m²;Okazja! Mieszkanie 62m2. Krakow, ul. Halszki.;Kraków , Podgórze Duchackie, Kurdwanów;3 pokoje;490000.0;62.0;7903.0;https://www.otodom.pl/oferta/okazja-mieszkanie-62m2-krakow-ul-halszki-ID44O8A.html#51e2ab8c8f;2020-02-23 10:11:28.904191;0.0;4.0;1985.0;Halszki;Kraków , Podgórze Duchackie, Kurdwanów, Halszki;Halszki, Kurdwanów, Podgórze Duchackie, Delegatura Kraków-Podgórze, Kraków, województwo małopolskie, Polska;(50.0056624, 19.949616272633136, 0.0);50.0056624;19.949616272633136;0.0;POINT (568027.2667013287 238029.735046762)
67 m²;Ładne Słoneczne Zadbane Z Tarasem Kobierzyn;Kraków , Dębniki, Kobierzyn;3 pokoje;575000.0;67.0;8582.0;https://www.otodom.pl/oferta/ladne-sloneczne-zadbane-z-tarasem-kobierzyn-ID43vdH.html#51e2ab8c8f;2020-02-23 10:11:33.512418;0.0;3.0;2010.0;Słoneczne;Kraków , Dębniki, Kobierzyn, Słoneczne;FUP Kraków 11, Wojciecha Marii Bartla, Kobierzyn, Dębniki, Delegatura Kraków-Podgórze, Kraków, województwo małopolskie, 30-389, Polska;(49.9988969, 19.8958089, 0.0);49.9988969;19.8958089;0.0;POINT (564181.7536297874 237230.1971481992)
40,30 m²;Grzegórzki Nowe Słoneczne 2 Pok/Oddzielna Kuchnia;Kraków , Grzegórzki;2 pokoje;559000.0;40.3;13871.0;https://www.otodom.pl/oferta/grzegorzki-nowe-sloneczne-2-pok-oddzielna-kuchnia-ID43UZN.html#51e2ab8c8f;2020-02-23 10:11:36.908622;4.0;7.0;2019.0;Grzegórzecka;Kraków , Grzegórzki, Grzegórzecka;Grzegórzecka, Wesoła, Grzegórzki, Kraków, województwo małopolskie, 31532, Polska;(50.0587885, 19.9500605, 0.0);50.0587885;19.9500605;0.0;POINT (567984.0407130375 243935.0611747131)
80 m²;Słoneczne Ciche Duże Balkon Taras Komórka Dębniki;Kraków , Dębniki;3 pokoje;720000.0;80.0;9000.0;https://www.otodom.pl/oferta/sloneczne-ciche-duze-balkon-taras-komorka-debniki-ID44mPE.html#51e2ab8c8f;2020-02-23 10:11:38.215441;3.0;4.0;2006.0;Słoneczne;Kraków , Dębniki, Słoneczne;Słoneczne Kliny, Dębniki, Kraków, województwo małopolskie, 30-389, Polska;(50.0007588, 19.8913445, 0.0);50.0007588;19.8913445;0.0;POINT (563859.4321044431 237433.3236511061)
38 m²;Kazimierz / ok. Św. Wawrzyńca 38m2, 2pok, IV p !;Kraków , Stare Miasto, Kazimierz;2 pokoje;495000.0;38.0;13026.0;https://www.otodom.pl/oferta/kazimierz-ok-sw-wawrzynca-38m2-2pok-iv-p-ID43HIR.html#a4ecda7d5f;2020-02-23 10:11:44.800273;4.0;5.0;1920.0;Kazimierza;Kraków , Stare Miasto, Kazimierz, Kazimierza;Apartamenty Sekret Kazimierza, 34, Józefa, Kazimierz, Stare Miasto, Kraków, województwo małopolskie, 31-056, Polska;(50.0512307, 19.9469375, 0.0);50.0512307;19.9469375;0.0;POINT (567771.2149040747 243092.1779909022)
37,85 m²;Do wprowadzenia 38m Chełmońskiego;Kraków , Bronowice;2 pokoje;413000.0;37.85;10911.0;https://www.otodom.pl/oferta/do-wprowadzenia-38m-chelmonskiego-ID44DRY.html#a4ecda7d5f;2020-02-23 10:11:50.009068;1.0;2.0;2008.0;Chełmońskiego;Kraków , Bronowice, Chełmońskiego;Józefa Chełmońskiego, Bronowice Wielkie, Bronowice, Delegatura Kraków-Krowodrza, Kraków, województwo małopolskie, 31-346, Polska;(50.0983351, 19.890461, 0.0);50.0983351;19.890461;0.0;POINT (563666.9097622773 248278.1576568913)
65,50 m²;Bronowice 3p parter - 2016r;Kraków , Bronowice;3 pokoje;664000.0;65.5;10137.0;https://www.otodom.pl/oferta/bronowice-3p-parter-2016r-ID44JVp.html#a4ecda7d5f;2020-02-23 10:11:51.073319;1.0;3.0;2016.0;Bronowicka;Kraków , Bronowice, Bronowicka;Bronowicka, Stara Krowodrza, Bronowice, Delegatura Kraków-Krowodrza, Kraków, województwo małopolskie, 30-084, Polska;(50.0769526, 19.9030181, 0.0);50.0769526;19.9030181;0.0;POINT (564593.4482024474 245912.2633061446)
83,50 m²;Jasne Komfortowe Zadbane Taras Garaż Bronowice;Kraków , Bronowice;3 pokoje;899000.0;83.5;10766.0;https://www.otodom.pl/oferta/jasne-komfortowe-zadbane-taras-garaz-bronowice-ID43Am2.html#a4ecda7d5f;2020-02-23 10:11:52.732095;3.0;3.0;2000.0;Bronowicka;Kraków , Bronowice, Bronowicka;Bronowicka, Stara Krowodrza, Bronowice, Delegatura Kraków-Krowodrza, Kraków, województwo małopolskie, 30-084, Polska;(50.0769526, 19.9030181, 0.0);50.0769526;19.9030181;0.0;POINT (564593.4482024474 245912.2633061446)
39,01 m²;Przytulne, do wprowadzenia 39+16 m2 Chełmońskiego;Kraków , Bronowice;2 pokoje;399000.0;39.01;10228.0;https://www.otodom.pl/oferta/przytulne-do-wprowadzenia-39-16-m2-chelmonskiego-ID44umI.html#a4ecda7d5f;2020-02-23 10:11:54.806656;2.0;2.0;2008.0;Chełmońskiego;Kraków , Bronowice, Chełmońskiego;Józefa Chełmońskiego, Bronowice Wielkie, Bronowice, Delegatura Kraków-Krowodrza, Kraków, województwo małopolskie, 31-346, Polska;(50.0983351, 19.890461, 0.0);50.0983351;19.890461;0.0;POINT (563666.9097622773 248278.1576568913)
39,01 m²;Przytulne, do wprowadzenia 39m Chełmońskiego;Kraków , Prądnik Biały;2 pokoje;399000.0;39.01;10228.0;https://www.otodom.pl/oferta/przytulne-do-wprowadzenia-39m-chelmonskiego-ID44t8p.html#a4ecda7d5f;2020-02-23 10:11:59.271985;2.0;2.0;2008.0;Chełmońskiego;Kraków , Prądnik Biały, Chełmońskiego;Józefa Chełmońskiego, Bronowice Wielkie, Bronowice, Delegatura Kraków-Krowodrza, Kraków, województwo małopolskie, 31-346, Polska;(50.0983351, 19.890461, 0.0);50.0983351;19.890461;0.0;POINT (563666.9097622773 248278.1576568913)
63,32 m²;Przestronne, funkcjonalne 3pok Głowackiego;Kraków , Krowodrza;3 pokoje;570000.0;63.32;9002.0;https://www.otodom.pl/oferta/przestronne-funkcjonalne-3pok-glowackiego-ID44Ol6.html#a4ecda7d5f;2020-02-23 10:12:11.990420;2.0;4.0;2004.0;Słowackiego;Kraków , Krowodrza, Słowackiego;Aleja Juliusza Słowackiego, Kleparz, Krowodrza, Kraków, województwo małopolskie, 30-004, Polska;(50.0735485, 19.9360058, 0.0);50.0735485;19.9360058;0.0;POINT (566957.7834913594 245562.9411296882)
55 m²;Ciche mieszkanie w centrum ul. Wrocławska, GOTOWE!;Kraków , Krowodrza;3 pokoje;708000.0;55.0;12873.0;https://www.otodom.pl/oferta/ciche-mieszkanie-w-centrum-ul-wroclawska-gotowe-ID44H6H.html#5a3ac0e744;2020-02-23 10:12:16.776122;7.0;9.0;2019.0;Wrocławska;Kraków , Krowodrza, Wrocławska;Wrocławska, Stara Krowodrza, Krowodrza, Kraków, województwo małopolskie, 30-017, Polska;(50.0808192, 19.9179102, 0.0);50.0808192;19.9179102;0.0;POINT (565653.3926503791 246355.0193398139)
67 m²;KROWODERSKICH Zuchów 5 Niezależnych pokoi K GÓRKA!;Kraków , Krowodrza;5 pokoi;544000.0;67.0;8119.0;https://www.otodom.pl/oferta/krowoderskich-zuchow-5-niezaleznych-pokoi-k-gorka-ID44E7R.html#5a3ac0e744;2020-02-23 10:12:17.684249;4.0;4.0;1980.0;Zuchów;Kraków , Krowodrza, Zuchów;Krowoderskich Zuchów, Prądnik Biały, Kraków, województwo małopolskie, 31-271, Polska;(50.0838836, 19.930691, 0.0);50.0838836;19.930691;0.0;POINT (566563.2797053672 246706.9391442938)
51 m²;Okazja ! Obozowa - mieszkanie po remoncie 2 pokoje;Kraków , Podgórze;2 pokoje;413000.0;51.0;8098.0;https://www.otodom.pl/oferta/okazja-obozowa-mieszkanie-po-remoncie-2-pokoje-ID44Edt.html#5a3ac0e744;2020-02-23 10:12:28.990861;1.0;3.0;2005.0;Obozowa;Kraków , Podgórze, Obozowa;Obozowa, Kobierzyn, Łagiewniki-Borek Fałęcki, Delegatura Kraków-Podgórze, Kraków, województwo małopolskie, 30-384, Polska;(50.0162831, 19.9088353, 0.0);50.0162831;19.9088353;0.0;POINT (565091.5527027509 239173.914675843)
48,40 m²;Widokowe dwupokojowe z jasną kuchnią Żabiniec;Kraków , Prądnik Biały;2 pokoje;480000.0;48.4;9917.0;https://www.otodom.pl/oferta/widokowe-dwupokojowe-z-jasna-kuchnia-zabiniec-ID44ERi.html#5a3ac0e744;2020-02-23 10:12:34.868380;6.0;7.0;2001.0;Żabiniec;Kraków , Prądnik Biały, Żabiniec;Żabiniec, Prądnik Biały, Kraków, województwo małopolskie, 31-200, Polska;(50.0851745, 19.9473248, 0.0);50.0851745;19.9473248;0.0;POINT (567751.0951210554 246865.3778822608)
38 m²;Felińskiego, 2 pokoje, 38m2;Kraków , Prądnik Biały;2 pokoje;365000.0;38.0;9605.0;https://www.otodom.pl/oferta/felinskiego-2-pokoje-38m2-ID44O7S.html#eace19cb28;2020-02-23 10:12:59.661052;1.0;5.0;2013.0;Felińskiego;Kraków , Prądnik Biały, Felińskiego;Arcybiskupa Zygmunta Szczęsnego Felińskiego, Osiedle Gotyk, Prądnik Biały, Kraków, województwo małopolskie, 31-241, Polska;(50.1003129, 19.9670423, 0.0);50.1003129;19.9670423;0.0;POINT (569139.4476888189 248566.0846677488)
55,50 m²;Prądnik Biały 55,5M2 3 Pokoje;Kraków , Prądnik Biały;3 pokoje;600000.0;55.5;10811.0;https://www.otodom.pl/oferta/pradnik-bialy-55-5m2-3-pokoje-ID44O7R.html#eace19cb28;2020-02-23 10:13:00.722819;7.0;8.0;2014.0;Prądnicka;Kraków , Prądnik Biały, Prądnicka;Prądnicka, Prądnik Biały, Kraków, województwo małopolskie, 31-202, Polska;(50.0875229, 19.9385333, 0.0);50.0875229;19.9385333;0.0;POINT (567119.0717439586 247118.4659837764)
35 m²;Żwirki i Wigury, 2 pokoje, 35m2;Kraków , Grzegórzki, Olsza;2 pokoje;387000.0;35.0;11057.0;https://www.otodom.pl/oferta/zwirki-i-wigury-2-pokoje-35m2-ID44O7Q.html#eace19cb28;2020-02-23 10:13:02.049764;0.0;1.0;1920.0;Wigury;Kraków , Grzegórzki, Olsza, Wigury;Żwirki i Wigury, Olsza II, Prądnik Czerwony, Kraków, województwo małopolskie, 31-462, Polska;(50.0794421, 19.9722129, 0.0);50.0794421;19.9722129;0.0;POINT (569539.3139024054 246251.0925405584)
55,20 m²;Mieszkanie do odświeżenia, Ogrodniki, Podgórze;Kraków , Podgórze;1 pokój;399000.0;55.2;7228.0;https://www.otodom.pl/oferta/mieszkanie-do-odswiezenia-ogrodniki-podgorze-ID44O78.html#eace19cb28;2020-02-23 10:13:05.528224;2.0;2.0;1930.0;Ogrodniki;Kraków , Podgórze, Ogrodniki;Ogrodniki, Bonarka, Łagiewniki-Borek Fałęcki, Kraków, województwo małopolskie, 30-404, Polska;(50.0268704, 19.9354851, 0.0);50.0268704;19.9354851;0.0;POINT (566985.480651306 240374.2229871424)
50 m²;2-pokoje, po remoncie, Wysłouchów;Kraków , Podgórze Duchackie, Kurdwanów;2 pokoje;375000.0;50.0;7500.0;https://www.otodom.pl/oferta/2-pokoje-po-remoncie-wyslouchow-ID44O77.html#eace19cb28;2020-02-23 10:13:06.947655;4.0;4.0;2002.0;Wysłouchów;Kraków , Podgórze Duchackie, Kurdwanów, Wysłouchów;Wysłouchów, Marii i Bolesława Wysłouchów, Kurdwanów, Podgórze Duchackie, Kraków, województwo małopolskie, 30-611, Polska;(50.0082278, 19.951703, 0.0);50.0082278;19.951703;0.0;POINT (568173.1214385193 238316.7762070829)
74 m²;3-pokoje po remoncie, ul. Sucha, Łagiewniki;Kraków , Łagiewniki-Borek Fałęcki;3 pokoje;550000.0;74.0;7432.0;https://www.otodom.pl/oferta/3-pokoje-po-remoncie-ul-sucha-lagiewniki-ID44O5G.html#eace19cb28;2020-02-23 10:13:11.736550;4.0;4.0;1998.0;Sucha;Kraków , Łagiewniki-Borek Fałęcki, Sucha;Sucha, Łagiewniki, Łagiewniki-Borek Fałęcki, Kraków, województwo małopolskie, 30-420, Polska;(50.0235619, 19.9352619, 0.0);50.0235619;19.9352619;0.0;POINT (566974.0990997 240006.2861540318)
60 m²;Bezpośrednio sprzedam Kazimierz. 3 pokoje 60m2;Kraków , Stare Miasto, Kazimierz;3 pokoje;699000.0;60.0;11650.0;https://www.otodom.pl/oferta/bezposrednio-sprzedam-kazimierz-3-pokoje-60m2-ID43yTF.html#eace19cb28;2020-02-23 10:13:12.779019;3.0;3.0;1932.0;Kazimierza;Kraków , Stare Miasto, Kazimierz, Kazimierza;Apartamenty Sekret Kazimierza, 34, Józefa, Kazimierz, Stare Miasto, Kraków, województwo małopolskie, 31-056, Polska;(50.0512307, 19.9469375, 0.0);50.0512307;19.9469375;0.0;POINT (567771.2149040747 243092.1779909022)
100,60 m²;5 Pokoi 113m2 + balkon | Stare Miasto | Sebastiana;Kraków , Stare Miasto;5 pokoi;1149000.0;100.6;11421.0;https://www.otodom.pl/oferta/5-pokoi-113m2-balkon-stare-miasto-sebastiana-ID43yk6.html#a613ca9287;2020-02-23 10:13:23.989730;3.0;3.0;2020.0;Sebastiana;Kraków , Stare Miasto, Sebastiana;Świętego Sebastiana, Kazimierz, Stare Miasto, Kraków, województwo małopolskie, 31-050, Polska;(50.0545616, 19.9451494, 0.0);50.0545616;19.9451494;0.0;POINT (567638.5622033864 243460.7861377941)
90,97 m²;*Świetny układDla rodziny lub inwestycja!Roi 6,2%;Kraków , Krowodrza;4 pokoje;679000.0;90.97;7464.0;https://www.otodom.pl/oferta/swietny-ukladdla-rodziny-lub-inwestycja-roi-6-2-ID44EDb.html#a613ca9287;2020-02-23 10:13:41.276867;4.0;4.0;1997.0;Rodziny;Kraków , Krowodrza, Rodziny;Katolickie Szkoły im.Świętej Rodziny z Nazaretu, Pędzichów, Kleparz, Stare Miasto, Kraków, województwo małopolskie, 31-152, Polska;(50.06999585, 19.94018479506805, 0.0);50.06999585;19.94018479506805;0.0;POINT (567261.6953024454 245171.8180097351)
66 m²;Mieszkanie, Grzegórzki 66m2.;Kraków , Grzegórzki;2 pokoje;699000.0;66.0;10591.0;https://www.otodom.pl/oferta/mieszkanie-grzegorzki-66m2-ID44LgR.html#a613ca9287;2020-02-23 10:13:45.009358;2.0;2.0;1920.0;Grzegórzecka;Kraków , Grzegórzki, Grzegórzecka;Grzegórzecka, Wesoła, Grzegórzki, Kraków, województwo małopolskie, 31532, Polska;(50.0587885, 19.9500605, 0.0);50.0587885;19.9500605;0.0;POINT (567984.0407130375 243935.0611747131)
60 m²;Apartament ***** Wiślane Tarasy 2.0 - Grzegórzecka;Kraków , Grzegórzki;3 pokoje;1190000.0;60.0;19833.0;https://www.otodom.pl/oferta/apartament-wislane-tarasy-2-0-grzegorzecka-ID44gQV.html#a613ca9287;2020-02-23 10:13:46.945502;2.0;8.0;2019.0;Wiślana;Kraków , Grzegórzki, Wiślana;Mierzeja Wiślana, Mały Płaszów, Podgórze, Kraków, województwo małopolskie, 30-716, Polska;(50.038134, 20.0042085, 0.0);50.038134;20.0042085;0.0;POINT (571889.5218590654 241689.9986086423)
58 m²;3 pok mieszkanie w Dębnikach 58 mkw za 360 000 zł!;Kraków , Dębniki;3 pokoje;360000.0;58.0;6207.0;https://www.otodom.pl/oferta/3-pok-mieszkanie-w-debnikach-58-mkw-za-360-000-zl-ID44NZd.html#a613ca9287;2020-02-23 10:13:51.781142;2.0;2.0;2006.0;Dębnicka;Kraków , Dębniki, Dębnicka;Dębnicka, Dębniki, Delegatura Kraków-Podgórze, Kraków, województwo małopolskie, 30-324, Polska;(50.0486355, 19.9229271, 0.0);50.0486355;19.9229271;0.0;POINT (566056.4070851903 242782.2246920913)
85 m²;4 pok mieszkanie w Dębnikach 85 mkw za 590 000 zł!;Kraków , Podgórze;4 pokoje;590000.0;85.0;6941.0;https://www.otodom.pl/oferta/4-pok-mieszkanie-w-debnikach-85-mkw-za-590-000-zl-ID44NZc.html#a613ca9287;2020-02-23 10:13:52.839893;1.0;4.0;1970.0;Dębnicka;Kraków , Podgórze, Dębnicka;Dębnicka, Dębniki, Delegatura Kraków-Podgórze, Kraków, województwo małopolskie, 30-324, Polska;(50.0486355, 19.9229271, 0.0);50.0486355;19.9229271;0.0;POINT (566056.4070851903 242782.2246920913)
59 m²;Angel City ul. Pawia / ul. Szlak 2 pokoje;Kraków , Stare Miasto;2 pokoje;700000.0;59.0;11864.0;https://www.otodom.pl/oferta/angel-city-ul-pawia-ul-szlak-2-pokoje-ID44Dgp.html#1797ff2c09;2020-02-23 10:13:57.012826;1.0;5.0;2009.0;Pawia;Kraków , Stare Miasto, Pawia;Pawia, Kleparz, Stare Miasto, Kraków, województwo małopolskie, 31-154, Polska;(50.0691779, 19.9451093, 0.0);50.0691779;19.9451093;0.0;POINT (567615.1434787014 245085.3479808709)
56 m²;Ładne mieszkanie 56 mkw przy Parku Wyspiańskiego!;Kraków , Krowodrza;5 pokoi;519000.0;56.0;9268.0;https://www.otodom.pl/oferta/ladne-mieszkanie-56-mkw-przy-parku-wyspianskiego-ID44NZ8.html#1797ff2c09;2020-02-23 10:13:59.326108;9.0;10.0;1980.0;Wyspiańskiego;Kraków , Krowodrza, Wyspiańskiego;Stanisława Wyspiańskiego, Nowa Wieś, Krowodrza, Kraków, województwo małopolskie, 30-035, Polska;(50.0729261, 19.9254295, 0.0);50.0729261;19.9254295;0.0;POINT (566202.0695347141 245484.3358220262)
23,43 m²;Kazimierz | Sprzedaż mieszkań na krótki wynajem;Kraków , Stare Miasto, Kazimierz;1 pokój;563070.37;23.43;24032.0;https://www.otodom.pl/oferta/kazimierz-sprzedaz-mieszkan-na-krotki-wynajem-ID44z5G.html#1797ff2c09;2020-02-23 10:14:00.496249;3.0;4.0;2019.0;Kazimierza;Kraków , Stare Miasto, Kazimierz, Kazimierza;Apartamenty Sekret Kazimierza, 34, Józefa, Kazimierz, Stare Miasto, Kraków, województwo małopolskie, 31-056, Polska;(50.0512307, 19.9469375, 0.0);50.0512307;19.9469375;0.0;POINT (567771.2149040747 243092.1779909022)
33,16 m²;Atrakcyjna kawalerka z tarasem, ul. Sosnowiecka;Kraków , Prądnik Biały, Bronowice Wielkie;1 pokój;362000.0;33.16;10917.0;https://www.otodom.pl/oferta/atrakcyjna-kawalerka-z-tarasem-ul-sosnowiecka-ID44KuW.html#1797ff2c09;2020-02-23 10:14:04.821326;2.0;3.0;2016.0;Sosnowiecka;Kraków , Prądnik Biały, Bronowice Wielkie, Sosnowiecka;Sosnowiecka, Bronowice Wielkie, Bronowice, Delegatura Kraków-Krowodrza, Kraków, województwo małopolskie, 31-345, Polska;(50.092531, 19.8931526, 0.0);50.092531;19.8931526;0.0;POINT (563867.0684092317 247635.3261533063)
