;opis;dzielnica;pokoje;cena;metraz;cena_za_metr;link;data;ulica;lokator_ulica_dzielnica;geo_location;point;latitude;longitude;altitude;geometry
0;Bezpośrednio sprzedam Kazimierz. 3 pokoje 60m2;Kraków , Stare Miasto, Kazimierz;3 pokoje;699000.0;60.0;11650.0;https://www.otodom.pl/oferta/bezposrednio-sprzedam-kazimierz-3-pokoje-60m2-ID43yTF.html#de3f47c1fe;2020-02-21 16:09:27.961759;Kazimierza;Kraków , Stare Miasto, Kazimierz, Kazimierza;Apartamenty Sekret Kazimierza, 34, Józefa, Kazimierz, Stare Miasto, Kraków, województwo małopolskie, 31-056, Polska;(50.0512307, 19.9469375, 0.0);50.0512307;19.9469375;0.0;POINT (567771.2149040747 243092.1779909022)
2;Przytulne dwa pokoje z ogródkiem, Rakowicka 35m2;Kraków , Stare Miasto;2 pokoje;512000.0;35.0;14629.0;https://www.otodom.pl/oferta/przytulne-dwa-pokoje-z-ogrodkiem-rakowicka-35m2-ID44d0h.html#de3f47c1fe;2020-02-21 16:09:27.961759;Rakowicka;Kraków , Stare Miasto, Rakowicka;Rakowicka, Warszawskie, Grzegórzki, Delegatura Kraków-Śródmieście, Kraków, województwo małopolskie, 31-520, Polska;(50.0751438, 19.9577519, 0.0);50.0751438;19.9577519;0.0;POINT (568511.1065507758 245759.9750759406)
3;Słoneczne mieszkanie z tarasem i własnym ogródkiem;Kraków , Swoszowice;2 pokoje;450000.0;51.43;8750.0;https://www.otodom.pl/oferta/sloneczne-mieszkanie-z-tarasem-i-wlasnym-ogrodkiem-ID44E2W.html#de3f47c1fe;2020-02-21 16:09:27.961759;Słoneczne;Kraków , Swoszowice, Słoneczne;FUP Kraków 11, Wojciecha Marii Bartla, Kobierzyn, Dębniki, Delegatura Kraków-Podgórze, Kraków, województwo małopolskie, 30-389, Polska;(49.9988969, 19.8958089, 0.0);49.9988969;19.8958089;0.0;POINT (564181.7536297874 237230.1971481992)
5;Mazowiecka, 2 niezależne pok, MPEC, balkon;Kraków , Krowodrza;2 pokoje;399000.0;34.0;11735.0;https://www.otodom.pl/oferta/mazowiecka-2-niezalezne-pok-mpec-balkon-ID44NPO.html#de3f47c1fe;2020-02-21 16:09:27.961759;Mazowiecka;Kraków , Krowodrza, Mazowiecka;Mazowiecka, Nowa Wieś, Krowodrza, Kraków, województwo małopolskie, 30-015, Polska;(50.0741152, 19.9291891, 0.0);50.0741152;19.9291891;0.0;POINT (566469.3704988041 245619.8426204808)
20;Nowe 1 pok. mieszkanie Bronowice;Kraków , Bronowice, Bronowice Małe;1 pokój;390000.0;28.2;13830.0;https://www.otodom.pl/oferta/nowe-1-pok-mieszkanie-bronowice-ID44iWY.html#de3f47c1fe;2020-02-21 16:09:27.965773;Bronowicka;Kraków , Bronowice, Bronowice Małe, Bronowicka;Bronowicka, Bronowice Małe, Bronowice, Delegatura Kraków-Krowodrza, Kraków, województwo małopolskie, 30-139, Polska;(50.0816928, 19.8902943, 0.0);50.0816928;19.8902943;0.0;POINT (563677.0404730459 246428.2142655198)
22;1 -pok mieszkanie na Kazimierzu;Kraków , Stare Miasto, Kazimierz;1 pokój;420000.0;32.1;13084.0;https://www.otodom.pl/oferta/1-pok-mieszkanie-na-kazimierzu-ID448S3.html#de3f47c1fe;2020-02-21 16:09:27.965773;Kazimierza;Kraków , Stare Miasto, Kazimierz, Kazimierza;Apartamenty Sekret Kazimierza, 34, Józefa, Kazimierz, Stare Miasto, Kraków, województwo małopolskie, 31-056, Polska;(50.0512307, 19.9469375, 0.0);50.0512307;19.9469375;0.0;POINT (567771.2149040747 243092.1779909022)
26;2 osobne pokoje Widok, Al. Pokoju - 44,4m2 balkon;Kraków , Grzegórzki, Dąbie;2 pokoje;435000.0;44.4;9797.0;https://www.otodom.pl/oferta/2-osobne-pokoje-widok-al-pokoju-44-4m2-balkon-ID43qgm.html#de3f47c1fe;2020-02-21 16:09:27.965773;Widok;Kraków , Grzegórzki, Dąbie, Widok;Widok, Dąbie, Grzegórzki, Kraków, województwo małopolskie, 31-567, Polska;(50.0573772, 19.9789268, 0.0);50.0573772;19.9789268;0.0;POINT (570051.6640617081 243804.857423231)
30;79m2 3pok z z garażem i piwnicą -Dobrego Pasterza;Kraków , Prądnik Czerwony;3 pokoje;620000.0;79.0;7848.0;https://www.otodom.pl/oferta/79m2-3pok-z-z-garazem-i-piwnica-dobrego-pasterza-ID43OY6.html#bcc2421ba9;2020-02-21 16:09:29.439086;Pasterza;Kraków , Prądnik Czerwony, Pasterza;Kościół pw. Pana Jezusa Dobrego Pasterza, 4, Dobrego Pasterza, Prądnik Czerwony, Kraków, województwo małopolskie, 31-416, Polska;(50.08851445, 19.95839608107648, 0.0);50.08851445;19.95839608107648;0.0;POINT (568538.1184385554 247246.7144761141)
32;Meissnera 3 pok 59m2 od strony skweru;Kraków , małopolskie;3 pokoje;539000.0;59.3;9089.0;https://www.otodom.pl/oferta/meissnera-3-pok-59m2-od-strony-skweru-ID44h4p.html#bcc2421ba9;2020-02-21 16:09:29.439086;Meissnera;Kraków , małopolskie, Meissnera;Meissnera, Wieczysta, Prądnik Czerwony, Kraków, województwo małopolskie, Polska;(50.0747583, 19.979541765513375, 0.0);50.0747583;19.979541765513375;0.0;POINT (570070.3419826203 245737.3370362194)
33;Rozkładowe 2 pokojowe na os. Krowodrza Górka;Kraków , Prądnik Biały;2 pokoje;364900.0;38.0;9603.0;https://www.otodom.pl/oferta/rozkladowe-2-pokojowe-na-os-krowodrza-gorka-ID44NM0.html#bcc2421ba9;2020-02-21 16:09:29.439086;Góra;Kraków , Prądnik Biały, Góra;"Schron amunicyjny ""Łysa Góra"", Węgrzecka, Górka Narodowa, Prądnik Biały, Kraków, województwo małopolskie, 31-242, Polska";(50.105246, 19.96920205268595, 0.0);50.105246;19.96920205268595;0.0;POINT (569286.7417427578 249116.4023994775)
36;2-pokoje po remoncie na ul. Celarowskiej - Olsza;Kraków , Grzegórzki, Olsza;2 pokoje;399900.0;38.0;10524.0;https://www.otodom.pl/oferta/2-pokoje-po-remoncie-na-ul-celarowskiej-olsza-ID44NKk.html#bcc2421ba9;2020-02-21 16:09:29.439086;Celarowska;Kraków , Grzegórzki, Olsza, Celarowska;Celarowska, Olsza II, Grzegórzki, Delegatura Kraków-Śródmieście, Kraków, województwo małopolskie, 31-414, Polska;(50.0847797, 19.9566795, 0.0);50.0847797;19.9566795;0.0;POINT (568420.6788938151 246830.0227017598)
38;Ruczaj. Grota-Roweckiego. 72m, 4/4. (Z potencjałem;Kraków , Dębniki, Ruczaj;4 pokoje;569000.0;71.46;7962.0;https://www.otodom.pl/oferta/ruczaj-grota-roweckiego-72m-4-4-z-potencjalem-ID44kpG.html#bcc2421ba9;2020-02-21 16:09:29.439086;Grota-Roweckiego;Kraków , Dębniki, Ruczaj, Grota-Roweckiego;Generała Stefana Grota-Roweckiego, Osiedle Ruczaj-Zaborze, Łagiewniki-Borek Fałęcki, Delegatura Kraków-Podgórze, Kraków, województwo małopolskie, 30-376, Polska;(50.0293477, 19.91197, 0.0);50.0293477;19.91197;0.0;POINT (565298.3461236949 240628.7681384189)
47;2 pokojowe 40 m2 z balkonem w Bieńczycach;Kraków , Bieńczyce;2 pokoje;349000.0;42.0;8310.0;https://www.otodom.pl/oferta/2-pokojowe-40-m2-z-balkonem-w-bienczycach-ID44NIH.html#bcc2421ba9;2020-02-21 16:09:29.439086;Bieńczycka;Kraków , Bieńczyce, Bieńczycka;Bieńczycka, Osiedle Drugiego Pułku Lotniczego, Bieńczyce, Delegatura Kraków-Nowa Huta, Kraków, województwo małopolskie, 31-944, Polska;(50.0786883, 20.0258597, 0.0);50.0786883;20.0258597;0.0;POINT (573377.5804436035 246218.6255630124)
50;Rondo Mogilskie - 5 kawalerek w jednym budynku.;Kraków , Grzegórzki;5 pokoi;1599000.0;150.0;10660.0;https://www.otodom.pl/oferta/rondo-mogilskie-5-kawalerek-w-jednym-budynku-ID44gJl.html#bcc2421ba9;2020-02-21 16:09:29.439086;Mogilska;Kraków , Grzegórzki, Mogilska;Mogilska, Osiedle Oficerskie, Grzegórzki, Kraków, województwo małopolskie, 31-546, Polska;(50.0666451, 19.9682576, 0.0);50.0666451;19.9682576;0.0;POINT (569274.8436000848 244825.0336722834)
